{"globalRiskPaths":[".github/workflows/**","backend/uv.lock"],"invalidatesWhenChanged":[".ci-coordinator/**",".github/workflows/**"],"nodes":[{"dependents":["backend/tests"],"path":"backend/src","riskClasses":["source"]},{"dependents":[],"path":"backend/tests","riskClasses":["dependency","source"]}],"provenance":{"generator":"target-artifacts@1","schemaVersion":"dependency-graph/v1","source":"configured"}}
